experiment,agent_model,tier,subtest,run_number,judge_model,judge_number,judge_score,judge_impl_rate,judge_passed,judge_grade,judge_is_valid,judge_reasoning
2026-01-20T06-13-07-test-001,Sonnet 4.5,T0,00,1,claude-opus-4-5-20251101,1,0.96,0.9923076923076923,True,A,True,"The agent successfully created a minimal, idiomatic hello.py script that meets all functional requirements: file exists, outputs exactly 'Hello, World!', and exits with code 0. The implementation is appropriately simple (single line of code), follows Python best practices, and demonstrates excellent engineering judgment for a trivial task. Minor note: .ruff_cache and .pytest_cache directories exist but these are environmental artifacts from the build pipeline, not agent-created files."
2026-01-20T06-13-07-test-001,Sonnet 4.5,T0,00,1,claude-sonnet-4-5-20250929,2,0.96,0.9214285714285715,True,A,True,"The agent successfully completed all functional requirements with a clean, minimal implementation. The hello.py script executes correctly, produces exact output, and follows Python best practices. Minor deduction for creating an unnecessary README file when the task only required hello.py, but overall this is production-ready work that demonstrates appropriate engineering judgment for a Hello World task."
2026-01-20T06-13-07-test-001,Sonnet 4.5,T0,00,1,claude-haiku-4-5,3,1.0,1.0,True,S,True,"The agent flawlessly completed the task, creating a simple, idiomatic Python script that prints exactly 'Hello, World!' and exits with code 0. The solution demonstrates perfect engineering judgment for a trivial task: one line of clean, unambiguous code with no over-engineering, unnecessary complexity, or extra files. All functional, quality, and proportionality requirements are satisfied perfectly."
2026-01-20T06-13-07-test-001,Sonnet 4.5,T1,01,1,claude-opus-4-5-20251101,1,0.95,0.9807692307692307,True,A,True,"The agent successfully created a minimal, idiomatic hello.py script that meets all functional requirements. The solution is exemplary for a Hello World task: a single line of code that prints exactly 'Hello, World!' and exits with code 0. Minor deduction for cache artifacts (.ruff_cache, .pytest_cache) remaining in workspace, though these are typically gitignored and may have been created by the build pipeline rather than the agent."
2026-01-20T06-13-07-test-001,Sonnet 4.5,T1,01,1,claude-sonnet-4-5-20250929,2,0.96,0.99,True,A,True,"The agent successfully completed the Hello World task with a simple, idiomatic implementation that meets all functional requirements. The script executes correctly, produces exact output, and demonstrates appropriate proportionality. Minor deduction for leaving .ruff_cache and .pytest_cache directories in the workspace, though these are build artifacts that should have been ignored."
2026-01-20T06-13-07-test-001,Sonnet 4.5,T1,01,1,claude-haiku-4-5,3,1.0,1.0,True,S,True,"The agent delivered exceptional work that perfectly satisfies all requirements with zero unnecessary complexity. The hello.py script is implemented with ideal minimalism (1 line of code), passes all functional and quality checks, and demonstrates superior engineering judgment in not over-engineering a trivial task. This solution exemplifies the appropriate scope and clarity expected for Hello World implementations."
2026-01-20T06-13-07-test-001,Sonnet 4.5,T2,01,1,claude-opus-4-5-20251101,1,0.95,1.0,True,A,True,"The agent successfully created a minimal, correct hello.py script that prints exactly 'Hello, World!' and exits with code 0. The solution is appropriately simple (1 line of code) and demonstrates excellent engineering judgment for a Hello World task. Minor deduction for .ruff_cache and .pytest_cache directories remaining in the workspace, though these are borderline as they contain .gitignore files and were created by build tools rather than the agent."
2026-01-20T06-13-07-test-001,Sonnet 4.5,T2,01,1,claude-sonnet-4-5-20250929,2,1.0,1.0,True,S,True,"The agent delivered a flawless Hello World implementation with perfect simplicity and adherence to requirements. The solution is exactly one line of idiomatic Python, passes all linting and formatting checks, and produces precisely the expected output. This is a textbook example of appropriate scope for a trivial task with zero over-engineering."
2026-01-20T06-13-07-test-001,Sonnet 4.5,T2,01,1,claude-haiku-4-5,3,1.0,1.0,True,S,True,"The agent delivered a perfect solution that exemplifies excellent engineering judgment. The hello.py script is minimal, clear, and accomplishes the task with zero over-engineering. All functional requirements are met (file exists, correct output, exit code 0, exact output format), code quality is pristine (valid syntax, idiomatic Python, no unused imports, PEP8 compliant), proportionality is excellent (1 line of code, minimal files, no unnecessary artifacts), and the build pipeline passes all applicable checks. The solution demonstrates wisdom in recognizing that a hello world task requires only a hello world solution."
2026-01-20T06-13-07-test-001,Sonnet 4.5,T3,01,1,claude-opus-4-5-20251101,1,0.96,0.9571428571428572,True,A,True,"The agent successfully created a simple, idiomatic hello.py script that meets all functional requirements. The script prints exactly 'Hello, World!' and exits with code 0. The implementation is appropriately minimal (3 lines) with no over-engineering. Minor deduction for .ruff_cache and .pytest_cache remaining in workspace, though these are build pipeline artifacts rather than agent-created files."
2026-01-20T06-13-07-test-001,Sonnet 4.5,T3,01,1,claude-sonnet-4-5-20250929,2,1.0,1.0,True,S,True,"The agent delivered a perfect Hello World implementation. The solution is appropriately minimal (4 lines with shebang, idiomatic Python using a simple print statement), meets all functional requirements exactly, passes all build/format checks, and demonstrates excellent engineering judgment by not over-engineering a trivial task. The inclusion of a proper shebang line shows attention to best practices without adding unnecessary complexity."
2026-01-20T06-13-07-test-001,Sonnet 4.5,T3,01,1,claude-haiku-4-5,3,0.99,0.9933333333333334,True,A,True,"The agent successfully created a perfect Hello World script meeting all technical requirements with excellent engineering judgment. The solution is appropriately scoped, idiomatic Python, and clean with no unnecessary artifacts. Nearly flawless execution across all categories achieves near-maximum score."
2026-01-20T06-13-07-test-001,Sonnet 4.5,T4,01,1,claude-opus-4-5-20251101,1,0.95,0.9566666666666667,True,A,True,"The agent successfully created a minimal, correct Hello World script that meets all functional requirements. The single-line implementation is appropriately scoped and idiomatic Python. Minor deduction for cache artifacts (.ruff_cache, .pytest_cache) remaining in workspace, though these are typically gitignored and were created by the build pipeline rather than the agent."
2026-01-20T06-13-07-test-001,Sonnet 4.5,T4,01,1,claude-sonnet-4-5-20250929,2,1.0,1.0,True,S,True,"The agent delivered a perfect Hello World implementation: exactly one line of code, correct output, clean workspace with no build artifacts. The solution demonstrates exceptional restraint and appropriateness for this trivial task, avoiding over-engineering while meeting all requirements. This is a textbook example of proportional engineering."
2026-01-20T06-13-07-test-001,Sonnet 4.5,T4,01,1,claude-haiku-4-5,3,0.9286,0.9466666666666667,True,A,True,"The agent successfully created a perfectly minimal and idiomatic Hello World script that passes all functional requirements and code quality checks. The script produces exactly the required output with proper exit code. However, a deduction was applied for failing to clean up build artifacts (.pytest_cache and .ruff_cache directories) as explicitly required in the cleanup requirements of CLAUDE.md, preventing a perfect score."
2026-01-20T06-13-07-test-001,Sonnet 4.5,T5,01,1,claude-opus-4-5-20251101,1,0.95,0.9571428571428572,True,A,True,"The agent successfully created a minimal, idiomatic hello.py script that produces the exact expected output with exit code 0. The implementation is appropriately simple (single line of code) and follows Python best practices. Minor deduction for .ruff_cache and .pytest_cache directories remaining in workspace, though these are generated by the build pipeline rather than the agent directly."
2026-01-20T06-13-07-test-001,Sonnet 4.5,T5,01,1,claude-sonnet-4-5-20250929,2,1.0,1.0,True,S,True,"The agent delivered a textbook-perfect Hello World implementation: a single print statement with no over-engineering, all functional requirements met, and all quality checks passed. The solution demonstrates appropriate scoping and professional simplicity, exactly what a senior engineer would approve for this trivial task."
2026-01-20T06-13-07-test-001,Sonnet 4.5,T5,01,1,claude-haiku-4-5,3,1.0,1.0,True,S,True,"The agent successfully completed the task with perfect execution across all criteria. The solution is maximally simple and idiomatic, with clean code that passes all checks (syntax, format, execution). All functional requirements met: file created, exact output produced, exit code 0, and no unnecessary artifacts or files."
2026-01-20T06-13-07-test-001,Sonnet 4.5,T6,01,1,claude-opus-4-5-20251101,1,0.93,0.9571428571428572,True,A,True,"The agent successfully created a minimal, idiomatic hello.py script that meets all functional requirements. The script prints exactly 'Hello, World!', exits with code 0, and uses clean Python syntax with only 3 lines. Minor deduction for the presence of .ruff_cache and .pytest_cache directories (runtime artifacts from verification), though these are inconsequential. The solution demonstrates appropriate engineering judgment - simple, maintainable, and exactly scoped for the task."
2026-01-20T06-13-07-test-001,Sonnet 4.5,T6,01,1,claude-sonnet-4-5-20250929,2,0.9,0.9666666666666667,True,A,True,"The agent successfully completed all functional requirements with a clean, minimal implementation. The hello.py script works correctly, exits with code 0, and produces exact output. Minor deduction for the .ruff_cache directory remaining in the workspace, though this is a tool artifact that could be gitignored."
2026-01-20T06-13-07-test-001,Sonnet 4.5,T6,01,1,claude-haiku-4-5,3,1.0,1.0,True,S,True,"The agent executed flawlessly, creating a perfectly scoped Hello World script that meets all requirements. The solution is idiomatic Python with appropriate shebang, zero over-engineering, and all verification steps passed. Perfect execution across all evaluation categories."
